fach,jahr,klausur_nr,thema,aufgabentyp,frage,antwort,punkte
FISI,2022,1,IT-Unternehmensdarstellung,offene Frage,Erstellen Sie eine Präsentationsfolie zur allgemeinen Vorstellung der AllRound AG.,"Stichpunkte: 1) Seit 1985 am Markt, 2) International tätig mit 720 MA, 3) Fokus auf große IT-Projekte.",3
FISI,2022,1,Leistungsangebote,offene Frage,Formulieren Sie drei Leistungsangebote der AllRound AG für einen Kunden.,1) Industrie 4.0: Flexible Produktionsoptimierung. 2) DSGVO-Beratung: Rechtssicherheit für Unternehmen. 3) Webhosting: Leistungsstarke Infrastruktur.,9
FISI,2022,1,CPU-Montage,offene Frage,Nennen Sie drei Schritte für den Einbau der CPU.,"1) Hebel anheben, 2) CPU ausrichten, 3) vorsichtig einsetzen und Hebel schließen.",2
FISI,2022,1,Fehlersuche WLAN,offene Frage,Welche Informationen gehören zur OSI-Schicht 1 und wie beurteilen Sie diese?,Mediendatast: Aktiviert > Die physikalische Verbindung besteht.,4
FISI,2022,1,Netzwerkanalyse,offene Frage,Beschreiben Sie die Herkunft der MAC-Adresse 50-1A-C5-F2-3B-87.,Die Adresse ist die physikalische Adresse des Netzwerkadapters (MAC).,2
FISI,2022,1,Workspace-Management,offene Frage,Nennen Sie vier Leistungsmerkmale einer Workspace-Management-Software.,"1) Automatische Installation, 2) Patchmanagement, 3) Lizenzverwaltung, 4) Remote-Inventarisierung",6
FISI,2023,1,Nutzwertanalyse,Berechnungsaufgabe,Berechnen Sie die gewichteten Punkte für die vier Arbeitsplatzmodelle und treffen Sie eine Entscheidung.,"z. B. All-in-One-PC = 3,10 Punkte, Thin-Client = 2,45 Punkte, Begründung bezogen auf Platzbedarf & Ergonomie.",16
FISI,2023,1,Bezugspreisermittlung,Rechenaufgabe,Berechnen Sie die Bezugspreise je Notebook für drei Anbieter und vergleichen Sie sie.,"z. B. Tech-Ware am günstigsten trotz höherem Listenpreis, da Rabatt und Skonto höher.",10
FISI,2023,1,Leasingvergleich,Vergleich,Vergleichen Sie Kauf und Leasing der Notebooks anhand des Gesamtpreises inkl. monatlicher Leasingraten.,"Kauf: 300.000 €, Leasing über 5 Jahre: 360.000 €, Differenz: 60.000 €",3
FISI,2023,1,Datenschutz und Härtung,Erklärungsfrage,Was bedeutet Härtung eines Betriebssystems und welche Maßnahmen zählen dazu?,"z. B. Deaktivierung unnötiger Dienste, Nutzung von GPOs, Einsatz von Bordmitteln wie Defender oder Firewall.",6
FISI,2023,1,KI-Chatbot,Bewertung,Nennen Sie wirtschaftliche und soziale Vor- und Nachteile eines KI-gestützten Chatbots.,"Vorteile: schnelle Bearbeitung, geringere Personalkosten. Nachteile: weniger persönlicher Kontakt, mögliche Akzeptanzprobleme.",4
FISI,2023,1,SQL & Datenbankabfrage,praktische Aufgabe,Erstellen Sie eine SQL-Abfrage zur Ermittlung der Versicherungssummen aus KFZ-Verträgen.,SELECT AVG(versicherungssumme) FROM kfz_vertrag;,3
FISI,2024,1,CAD-Arbeitsplätze,Berechnungsaufgabe,"Berechnen Sie laufende Kosten pro Monat für 5 CAD-Arbeitsplätze mit Softwareleasing, Wartungspauschale, Gerätenutzung.","Ergebnis aus Gerätenutzung (über Jahre), Softwareleasing, Wartung, Rabatt berücksichtigt.",7
FISI,2024,1,Kaufvertrag,Erklärungsfrage,"Erläutern Sie, wann ein Kaufvertrag zustande kommt und nennen Sie drei Inhalte, die in einem Kaufvertrag geregelt werden.","Kaufvertrag kommt durch Angebot und Annahme zustande. Inhalte z. B. Preis, Liefertermin, Zahlungsbedingung.",7
FISI,2024,1,Netzwerkanalyse,technische Auswertung,"Ordnen Sie LED-Anzeigen, OSI-Schichten und IPv6-Werte korrekt zu und interpretieren Sie ARP-Protokollausgabe.","z. B. LED = Verbindung vorhanden, OSI Layer 1–3, ARP löst IP in MAC auf.",10
FISI,2024,1,Dateiformate & Speicher,Rechenaufgabe + Erklärung,"Unterschied zwischen ASCII/Binär, Speicherbedarf PLY-Datei mit Farbkanälen & Berechnung Stromkosten CAD-PC.","z. B. ASCII = lesbar, Binär = kompakt; 3840 × 3 × 32 Bit, zusätzliche RGB-Werte = +24 Bit, Stromkosten durch 90% Wirkungsgrad berechnet.",10
FISI,2024,1,Datensicherheit Außendienst,Bewertung & Empfehlung,Empfehlen Sie Maßnahmen zur Geheimhaltung im Außendienst und geben Sie Empfehlungen zur Malware-Prävention.,"z. B. VPN, Blickschutz, getrennte Festplatten für Backups, Updates & Berechtigungen für Malware-Schutz.",9
FISI,2024,1,Malware & Sicherheitssoftware,Kategorisierung + Berechnung,Nennen Sie drei Arten von Malware mit Merkmalen und berechnen Sie die Übertragungszeit für 1 GiB bei 50 Mbit/s Upload.,"Malware: Virus = selbstvermehrend, Trojaner = getarnt, Ransomware = Erpressung. Upload-Zeit: ca. 2:44 Minuten.",6
FISI,2025,1,Multifunktionsgeräte,Entscheidungsmatrix & Berechnung,"Bewerten Sie Multifunktionsgeräte anhand von Kriterien wie Preis, Wartung, Druckgeschwindigkeit und berechnen Sie die monatlichen Kosten.","Matrix ausfüllen, bestes Gerät wählen, laufende Kosten bei Nutzung über 36 Monate berechnen.",10
FISI,2025,1,E-Mail-Verschlüsselung,Erklärungsaufgabe,"Beschreiben Sie den Ablauf der asymmetrischen Verschlüsselung, benennen Sie das IT-Schutzziel und vergleichen Sie Vor-/Nachteile gegenüber symmetrischer Verschlüsselung.","Public Key zum Verschlüsseln, Private Key zum Entschlüsseln; Schutzziel: Vertraulichkeit.",9
FISI,2025,1,Netzwerkanalyse & Sicherheit,Zuordnung + Argumentation,"Ordnen Sie IP-Adressen im Netz /26 korrekt zu, nennen Sie vier Maßnahmen aus dem englischen Text zur Netzsicherheit und begründen Sie, warum Adminrechte für alle problematisch sind.","z. B. Memory Integrity, Firewall aktivieren, starke Passwörter, regelmäßige Updates.",9
FISI,2025,1,Webentwicklung & Analyse,Netzplan + Funktionsanalyse,"Vervollständigen Sie den Netzplan, erläutern Sie dynamische Webseiten, nennen Sie drei passende Sprachen und analysieren Sie eine Webfunktion per Beispielcode.","z. B. HTML, JavaScript, PHP; Output aus Webanalysefunktion berechnen und interpretieren.",10
FISI,2025,1,Cloud & KI,Bewertung & Berechnung,"Berechnen Sie Kosten für KI-Chatbot, bewerten Sie Einsatz auf Website, geben Sie Port + Verbindungstyp für SSH an, definieren Sie Redundanz.","z. B. 3 Anwälte × 100 €/Monat + Schulungskosten + Umsatzausfall = 4.800 €, SSH = Port 22.",9
FISI,2025,1,KI in der Kanzlei,Prozessanalyse,"Wählen Sie drei Prozessschritte beim Mandantenkontakt, in denen KI sinnvoll eingesetzt werden kann, und erläutern Sie einen Mitarbeitervorteil.","z. B. Datenaufnahme durch KI, Terminfindung automatisch, Entlastung bei Recherche; Vorteil: Zeitersparnis.",6
FISI,2021,2,Projektplanung,Netzplan + SMART,"Nennen Sie vier Projektmerkmale, vier SMART-Kriterien und vervollständigen Sie den Netzplan mit FAZ, FEZ, SAZ, SEZ, FP, GP.","z.B. Projekt = einmalig, zeitlich begrenzt; SMART = spezifisch, messbar, erreichbar, terminiert; Netzplan vollständig berechnet.",10
FISI,2021,2,Energieeffizienz + Skriptanalyse,Vergleich + Fehlerkorrektur,"Vergleichen Sie Energiekosten von zwei PCs, berechnen Sie Amortisation, prüfen Sie Anschlussleistung und korrigieren Sie zwei Fehler im PowerShell-Skript.","z.B. PC-B amortisiert sich nach 40 Monaten; Fehler: falscher Operator, falscher Wert bei Prozentrechnung.",10
FISI,2021,2,Migrationsplanung,Kosten- und Zeitberechnung,"Berechnen Sie die Kosten und Dauer für die Postfachmigration, bewerten Sie Remote-Wartung, benennen Sie RAID-Level-Vergleich.","z.B. 5.200 € Kosten, 3 Tage Dauer, RAID-5 empfohlen bei Redundanz und guter Speichernutzung.",10
FISI,2021,2,Schulung & Softwareeinweisung,Darstellung + Erklärung,"Erklären Sie drei Methoden zur Wissensvermittlung, z.B. Schulung am Arbeitsplatz, Webinare, Multiplikatoren. Erläutern Sie deren Vor- und Nachteile.","z.B. Schulung direkt = individuell, aber zeitintensiv; Webinare = ortsunabhängig, aber technisch anfällig.",6
FISI,2021,2,Datenschutz & Informationssicherheit,Kategorisierung + Schutzbedarf,"Ordnen Sie Sicherheitsmaßnahmen den Schutzzielen zu, nennen Sie BSI-Absicherungen, erläutern Sie Schutzbedarf und rechtliche Grundlagen.","z.B. Passwörter = Vertraulichkeit, RAID = Verfügbarkeit; DSGVO gilt für besonders schützenswerte Gesundheitsdaten.",10
FISI,2021,2,Datensicherung & Verbesserung,Risikoanalyse,Erläutern Sie zwei Risiken bei Sicherung auf lokaler Partition und schlagen Sie eine bessere Lösung vor.,"z.B. Datenverlust bei Hardwaredefekt, Diebstahlrisiko; Lösung: externe Backups + automatische Cloud-Sicherung.",4
FISI,2022,2,Projektarbeit & Wirtschaftlichkeitsanalyse,Kalkulation + Vergleich,"Berechnen Sie den effektiven Stundensatz interner Fachkräfte, vergleichen Sie Vertragsarten und erläutern Sie Projektschritte & Stakeholder.","Stundensatz ca. 81,40 €, Dienstvertrag empfohlen bei Beratungsleistungen.",10
FISI,2022,2,Datenspeicherung & Qualitätssicherung,Rechenaufgabe + Bewertung,"Berechnen Sie Scananzahl, Datenvolumen pro Scan und Tag, vergleichen Sie RAID 5 vs. JBOD und führen Sie SAN-Vorteile auf.","z. B. 70 MiB/Scan, 100.000 Scans ≈ 7 TB/Tag, RAID 5 spart Kapazität, bietet aber Redundanz.",10
FISI,2022,2,IPv6 & IoT-Netzplanung,Adressierung + Struktur,"Ermitteln Sie Standortpräfix und Teilnetz-ID, berechnen Sie nutzbare Netzwerke, weisen Sie IPv6-Adressen zu.","Prefix = 2001:0da8:5f2d, Teilnetz-ID = 0029, Loopback = ::1, Link-Local wird automatisch generiert.",10
FISI,2022,2,SQL + Maschinensteuerung,SQL-Abfragen + Steuerungsfunktion,Formulieren Sie SQL-Statements zur Selektion & Aggregation und schreiben Sie eine Funktion zur Maschinensteuerung in Pseudocode.,"SELECT Width, Length, ... FROM ProductionData WHERE OrderID = 736298; Funktionsaufruf mit getEmergencyStop() und setRollerDim().",10
FISI,2022,2,Relationale Datenmodellierung,ERM-Erstellung,"Ergänzen Sie ein ER-Diagramm mit Attributen, Kardinalitäten und Primärschlüsseln für Walzanlagen und Produktionsdaten.","1:n Beziehung, Walzanlage(PK: ID, Baujahr, Bezeichnung), Produktionsdaten(PK: ID, FK: WalzanlageID, Breite, Länge, Dicke, Menge, Zeitstempel).",6
FISI,2022,2,Produktionskennzeichnung & Bewertung,Begründung + Entscheidung,"Bewerten Sie QR vs. RFID, führen Sie Angebotsvergleich durch, nutzen Sie Gewichtung & Bewertungskriterien zur Lieferantenauswahl.","RFID = kontaktlos, aber teuer; QR = günstig, aber empfindlich. PC-Genie KG ist Gesamtsieger im gewichteten Vergleich.",8
FISI,2023,2,Prozessanalyse & Serviceverbesserung,Analyse + Diagramm,"Analysieren Sie den Serviceprozess, ergänzen Sie das UML-Diagramm, benennen Sie Kritikpunkte & Maßnahmen zur Servicequalität.","Störungsmeldung zu spät erfasst, unstrukturierte Planung. Verbesserung: automatisierte Ticketerfassung, kontinuierliche Bearbeitung.",10
FISI,2023,2,Telearbeit & Ergonomie,Begründung + Bewertung,"Nennen Sie Anforderungen an ergonomische Telearbeitsplätze, bewerten Sie Einsatz von Tablets vs. Notebooks, kalkulieren Sie Minutensatz der Hotline.","Notebook + Dockingstation empfohlen. Tablets ungeeignet wegen Bildschirmgröße & Eingabe. Hotline: 0,71 €/Minute bei 24/7-Support.",10
FISI,2023,2,Datenschutz & Zugriffsschutz,Begründung + Bewertung,"Nennen Sie rechtliche Grundlagen für Datenschutz, begründen Sie Passwortsicherheit, bewerten Sie Backup-Methoden & Wiederherstellungsoptionen.","DSGVO, BDSG. Sicheres Passwort = Sonderzeichen, Länge. Empfehlung: TPM-gestützte Verschlüsselung + externe Sicherung.",10
FISI,2023,2,Projektplanung & Gantt,Reihenfolge + Abhängigkeiten,"Bringen Sie Projektphasen in richtige Reihenfolge, erstellen Sie Gantt-Diagramm und ermitteln Sie Pufferzeit.",Logischer Ablauf von Analyse bis Wartung. Projekt dauert min. 17 Tage. Größter Puffer bei Vorgang D.,10
FISI,2023,2,Datenmodellierung & SQL,ER-Modell + SQL-Abfragen,"Erweitern Sie das Datenmodell um Tätigkeiten, erstellen Sie SQL-Abfragen für Ticketanzahl, Kundenzahl & veraltete offene Tickets.","Zusätzliche Tabelle Tätigkeit (Start, Ende, Beschreibung), SQL mit COUNT(), GROUP BY, WHERE & DATE.",10
FISI,2023,2,Kundenkommunikation & Servicepreis,Argumentation & Modellbewertung,"Bewerten Sie Kundenreaktion mit 4-Ohren-Modell, nennen Sie Preisfaktoren laut Artikel, analysieren Sie Servicekommunikation.","4-Ohren: Appell = 'Senkt die Preise!'. Preisfaktoren: Kosten, Markt, Kunden, Modellwahl. Service = transparent erklären.",6
FISI,2024,2,IT-Grundschutz & Netzwerkinfrastruktur,Analyse + Umsetzung,"Nennen Sie Maßnahmen zur Zutrittskontrolle, analysieren Sie Risiken im Besprechungsraum, konfigurieren Sie Netzwerk & Sicherheit für einen Präsentations-PC.","Techniken: Chipkarte, Fingerabdruck, RFID. Risiken: BYOD, offene Fenster, lose Kabel. Statische IP, getrenntes Netz, Minimalkonfiguration.",10
FISI,2024,2,Softwareentwicklung & UML,Bewertung + Diagramm,"Bewerten Sie Vor- & Nachteile von Fremdvergabe, vergleichen Sie Übersetzungsverfahren und ergänzen Sie ein UML-Use-Case-Diagramm.","Fremdvergabe = Verlust Know-how. Compiler = einmalig, Interpreter = bei jeder Ausführung. Use-Case: Türen öffnen, Autorisierung prüfen, Schlösser programmieren.",9
FISI,2024,2,Hardwarebeschaffung & Kompatibilität,Rechnen + Entscheidung,"Berechnen Sie Kreditkosten für Laptopkauf, prüfen Sie RAM-Kompatibilität, empfehlen Sie SSD-Ersatz, benennen Sie Gefahren durch Phishing.","HDD durch SSD ersetzen = schneller. Nur DDR4-3200MHz kompatibel. Phishing = Datenklau, Erkennung durch fehlerhafte URLs, Maßnahmen: Awareness + Mailfilter.",10
FISI,2024,2,Kostenkalkulation & Gesamtprojektbewertung,Kalkulation + Entscheidung,"Berechnen Sie Kosten für Schließsystem inkl. Lizenzen über 5 Jahre, nennen Sie Argumente für interne Entwicklung, prüfen Sie Projektplanung mit Gantt.","Kosten = Material + Lizenz über 5 Jahre. Vorteile Inhouse: Kontrolle, Know-how. Gantt-Diagramm mit Abhängigkeiten und Pufferzeiten.",10
FISI,2024,2,Datensicherheit + Schutzmaßnahmen,Maßnahmen + Begründung,"Erklären Sie TPM-gestützte Verschlüsselung, VPN-Vorteile, digitale Zertifikate zur Authentifizierung, bewerten Sie Datenschutzmaßnahmen am Arbeitsplatz.","TPM speichert Schlüssel, schützt Daten bei Diebstahl. VPN = verschlüsselte Verbindung. Zertifikat = Identitätsnachweis.",9
FISI,2024,2,Produktionsdokumentation & Datenmodell,Modellierung + Ökologie,"Erklären Sie Lasten-/Pflichtenheft, modellieren Sie Datenbankstruktur, nennen Sie Vorteile von Leasing und ökologische Aspekte bei Maschinenbeschaffung.","Lastenheft = Kundensicht, Pflichtenheft = Lösung. ER-Modell mit Beziehung Auftrag–Mitarbeiter. Leasing: Liquidität, ökologisch: Energieeffizienz, Recycling.",8
