fach,jahr,klausur_nr,thema,aufgabentyp,frage,antwort,saison
FISI,2022,1,IT-Unternehmensdarstellung,offene Frage,Erstellen Sie eine Präsentationsfolie zur allgemeinen Vorstellung der AllRound AG.,"Stichpunkte: 1) Seit 1985 am Markt, 2) International tätig mit 720 MA, 3) Fokus auf große IT-Projekte.",
FISI,2022,1,Leistungsangebote,offene Frage,Formulieren Sie drei Leistungsangebote der AllRound AG für einen Kunden.,1) Industrie 4.0: Flexible Produktionsoptimierung. 2) DSGVO-Beratung: Rechtssicherheit für Unternehmen. 3) Webhosting: Leistungsstarke Infrastruktur.,
FISI,2022,1,CPU-Montage,offene Frage,Nennen Sie drei Schritte für den Einbau der CPU.,"1) Hebel anheben, 2) CPU ausrichten, 3) vorsichtig einsetzen und Hebel schließen.",
FISI,2022,1,Fehlersuche WLAN,offene Frage,Welche Informationen gehören zur OSI-Schicht 1 und wie beurteilen Sie diese?,Medienstatus: Aktiviert → Die physikalische Verbindung besteht.,
FISI,2022,1,Netzwerkanalyse,offene Frage,Beschreiben Sie die Herkunft der MAC-Adresse 50-1A-C5-F2-38-B7.,Die Adresse ist die physikalische Adresse des Netzwerkadapters (MAC).,
FISI,2022,1,Workspace-Management,offene Frage,Nennen Sie vier Leistungsmerkmale einer Workspace-Management-Software.,"1) Automatische Installation, 2) Patchmanagement, 3) Lizenzverwaltung, 4) Remote-Inventarisierung",
FISI,2023,1,IT-Systeme,offene Frage,Erläutern Sie die Vor- und Nachteile eines zentralen Servers in einem Unternehmen.,"Vorteile: zentrale Verwaltung, Datensicherung, Sicherheit. Nachteile: Single Point of Failure, hohe Anschaffungskosten.",Frühjahr
FISI,2023,1,Netzwerke,multiple choice,Welche der folgenden Aussagen trifft auf ein Class-C-Netz zu?,Die Standard-Subnetzmaske ist 255.255.255.0.,Frühjahr
FISI,2023,1,Datenbanken,offene Frage,Was versteht man unter der Normalisierung von Datenbanken?,"Normalisierung ist der Prozess, Daten in Tabellen zu strukturieren, um Redundanzen zu vermeiden und Datenintegrität zu gewährleisten.",Frühjahr
FISI,2023,1,Projektmanagement,offene Frage,Erklären Sie die Bedeutung des Gantt-Diagramms im Projektmanagement.,"Ein Gantt-Diagramm visualisiert Aufgaben, ihre Zeitdauer und Abhängigkeiten im Zeitverlauf, um Projekte effizient zu planen und zu steuern.",Frühjahr
FISI,2023,1,Datenschutz,offene Frage,Welche Maßnahmen zur Datensicherheit in Unternehmen kennen Sie?,"Zugriffsrechte, Firewalls, Verschlüsselung, Backups, Schulung von Mitarbeitenden.",Frühjahr
FISI,2024,1,IT-Systeme,offene Frage,Ermitteln Sie die fehlenden Werte in der Tabelle zur Systemauswahl und nennen Sie die Reihenfolge der Unternehmen.,"Reihenfolge: 3, 1, 4, 2. Gewichtung und Punktberechnung nach Multiplikation der Werte.",Frühjahr
FISI,2024,1,Kostenrechnung,Berechnung,Berechnen Sie die monatlichen Gesamtkosten für die CAD-Arbeitsplätze mit angegebener Nutzungsdauer.,"PC: 720€, Monitor: 450€, Software: 50€/Monat, Wartung: 1200€/Jahr. Rechenweg mit Abschreibungen und Rabatten.",Frühjahr
FISI,2024,1,Netzwerke,Analyse,Erklären Sie die Bedeutung der LEDs an der Netzwerkkarte und die Informationen aus dem Befehl 'ipconfig /all'.,"LED durchgehend: Verbindung aktiv, LED blinkt: Datenaustausch. 'ipconfig' zeigt IP, Subnetz, MAC usw.",Frühjahr
FISI,2024,1,Netzwerkprotokolle,offene Frage,Erläutern Sie die Aufgabe des ARP-Protokolls in einem lokalen Netzwerk.,"ARP übersetzt IP-Adressen in MAC-Adressen, um die physikalische Kommunikation im LAN zu ermöglichen.",Frühjahr
FISI,2024,1,IT-Sicherheit,offene Frage,Nennen Sie Maßnahmen zur Geheimhaltung bei Außeneinsätzen und eine mögliche Folge bei Nichtbeachtung.,"Blickschutzfolie, VPN, keine sensiblen Gespräche. Folge: Datenleak, unerlaubter Zugriff.",Frühjahr
FISI,2024,1,Speicherberechnung,Berechnung,Berechnen Sie den Speicherbedarf für 3840 Punkte mit 32-Bit-Floats sowie die Farbanzahl und den Speicherzuwachs.,3840 × 3 × 4 Bytes = 46080 Bytes ≈ 45 KiB. Farbanzahl: 256³ = 16.777.216. Speicherzuwachs ≈ 100%.,Frühjahr
AP1,2025,1,Druckerauswahl & Kostenrechnung,offene Frage,Vervollständigen Sie die Entscheidungsmatrix zur Auswahl des Multifunktionsgeräts und wählen Sie das geeignetste Gerät.,"Multifunktionsgerät 2 ist aufgrund der besten Kombination aus Druckgeschwindigkeit, Wartungskosten und Preis zu wählen.",
AP1,2025,1,Kostenberechnung,Berechnung,Berechnen Sie die monatlichen Kosten für das gewählte Multifunktionsgerät unter Berücksichtigung von Nutzungsdauer und Seitenpreisen.,"Kosten = (0,05 € * 2000 + 0,07 € * 500 + Gerätepreis / 36 Monate).",
AP1,2025,1,IT-Sicherheit,offene Frage,Nennen Sie vier Maßnahmen aus dem gegebenen englischen Text zur Systemsicherheit.,"Sicherheitsbaseline anwenden, starke Passwörter nutzen, Firewall aktivieren, automatische Updates aktivieren.",
AP1,2025,1,E-Mail-Verschlüsselung,offene Frage,"Beschreiben Sie, wie die asymmetrische Verschlüsselung beim E-Mail-Verkehr zwischen Anwalt und Mandant funktioniert.",Der Anwalt verschlüsselt die Nachricht mit dem öffentlichen Schlüssel des Mandanten. Nur der Mandant kann sie mit seinem privaten Schlüssel entschlüsseln.,
AP1,2025,1,Webentwicklung,offene Frage,Erläutern Sie den Unterschied zwischen einer statischen und einer dynamischen Website.,"Statische Websites zeigen immer denselben Inhalt, während dynamische Inhalte serverseitig generiert und personalisiert werden können.",
AP1,2025,1,KI im Kanzleialltag,offene Frage,Nennen Sie drei sinnvolle Einsatzbereiche von KI innerhalb des beschriebenen Ablaufs in der Kanzlei.,"Recherche zu Mandantendaten, automatische Terminvorschläge, Unterstützung bei Vorabrecherche für Anwälte.",
FISI,2026,1,Netzwerke,Multiple Choice,"Welches Protokoll wird genutzt, um IP-Adressen automatisch zuzuweisen?",DHCP,Frühjahr
FISI,2026,2,Datenbanken,Offene Frage,Erklären Sie den Unterschied zwischen einer relationalen Datenbank und einer NoSQL-Datenbank.,"Eine relationale Datenbank ist ein typisches Datenbankmanagementsystem, das auf der Basis der relationalen Algebra arbeitet. Die Daten werden in Tabellen gespeichert, die über eindeutige Schlüssel miteinander verknüpft werden können. Eine NoSQL-Datenbank hingegen ist ein nicht-relationales Datenbankmanagementsystem, das für den Umgang mit großen Datenmengen und Echtzeit-Anwendungen konzipiert ist. Sie speichert Daten in einem Format, das nicht tabellenbasiert ist, z.B. als JSON-Dokumente, Graphen oder Schlüssel-Wert-Paare.",Frühjahr
FISI,2026,3,OOP,Berechnung,"Wie viele Methoden sind in einer Java-Klasse, die 2 Getter, 2 Setter, 1 Konstruktor und 1 Hilfsmethode enthält?",6,Frühjahr
